{
  "schema_version": 1,
  "metric_definition_version": 3,
  "metric_definition": {
    "version": 3,
    "forbidden_end": {
      "tail_scope": "eligible-internal-plus-document-final",
      "alternative_source": "pre-split-punctuated-source-phrase-lattice",
      "reported_measure": "rate-with-bad-and-eligible",
      "gate_measure": "bad-count",
      "baseline_bad_slack": 1.0,
      "ja_tail_lens": {
        "id": "ja-unidic-level2",
        "source": "kinsoku.ja_pos_end_penalties",
        "provider": "fugashi-unidic",
        "provider_version": "1.5.2",
        "dictionary": "unidic-lite 1.0.8 (UnidicFeatures26)",
        "context": "punctuated-source-phrase-atom",
        "missing_offset_fallback": "ja-char-table-level1"
      }
    }
  },
  "metric_definition_digest": "89bf5b31753e9d80b132f0df154ac341a12082e0e340eee37b68342264842425",
  "corpus_digest": "23df693e438693bc5192acd1f605b394d93a2bd5ada39e63ba38a3fef6fae9c6",
  "generated_from_commit": "83233811692eb1a1b1ab0b859cb77236ad1f4a34",
  "environment": {
    "python": "3.13.12",
    "dependencies": {
      "pysbd": "0.3.4",
      "budoux": "0.8.4",
      "jieba": "0.42.1",
      "fugashi": "1.5.2"
    }
  },
  "groups": {
    "all": {
      "case_count": 20,
      "cue_count": 2081,
      "cps_p90": {
        "n": 2081,
        "value": 16.514285714285688,
        "median": 7.065217391304334,
        "p95": 18.801410105757952,
        "target_cps": null,
        "absolute_max": null
      },
      "phrase_granularity": [
        "phrase",
        "word"
      ],
      "diagnostics": {
        "unit_count": 22972,
        "cue_count": 2081,
        "lyric_cue_count": 0,
        "internal_boundaries": 2061,
        "unmapped_boundaries": 0,
        "overlapping_cues": 0,
        "silence_breaks": 283,
        "forced_breaks": 235,
        "punctuation_breaks": 1360,
        "no_legal_alternative": 69,
        "final_tail_eligible": 18,
        "terminal_final_tails": 2,
        "exempted_cues": 0
      },
      "len_break_mid_phrase_rate": {
        "bad": 1,
        "eligible": 1778,
        "value": 0.0005624296962879641
      },
      "over_7s_rate": {
        "bad": 0,
        "eligible": 2081,
        "value": 0.0
      },
      "forbidden_end_rate": {
        "bad": 3,
        "eligible": 415,
        "value": 0.007228915662650603
      }
    },
    "en": {
      "case_count": 6,
      "cue_count": 565,
      "cps_p90": {
        "n": 565,
        "value": 20.71220186649996,
        "median": 15.330565314595905,
        "p95": 22.628701539872594,
        "target_cps": 17.0,
        "absolute_max": 21.25
      },
      "phrase_granularity": [
        "word"
      ],
      "diagnostics": {
        "unit_count": 4741,
        "cue_count": 565,
        "lyric_cue_count": 0,
        "internal_boundaries": 559,
        "unmapped_boundaries": 0,
        "overlapping_cues": 0,
        "silence_breaks": 84,
        "forced_breaks": 39,
        "punctuation_breaks": 472,
        "no_legal_alternative": 0,
        "final_tail_eligible": 6,
        "terminal_final_tails": 0,
        "exempted_cues": 0
      },
      "len_break_mid_phrase_rate": {
        "bad": 0,
        "eligible": 475,
        "value": 0.0
      },
      "over_7s_rate": {
        "bad": 0,
        "eligible": 565,
        "value": 0.0
      },
      "forbidden_end_rate": {
        "bad": 3,
        "eligible": 54,
        "value": 0.05555555555555555
      }
    },
    "ja": {
      "case_count": 7,
      "cue_count": 659,
      "cps_p90": {
        "n": 659,
        "value": 7.142857142857198,
        "median": 5.065666041275786,
        "p95": 7.929600886917963,
        "target_cps": 7.0,
        "absolute_max": 8.75
      },
      "phrase_granularity": [
        "phrase"
      ],
      "diagnostics": {
        "unit_count": 6491,
        "cue_count": 659,
        "lyric_cue_count": 0,
        "internal_boundaries": 652,
        "unmapped_boundaries": 0,
        "overlapping_cues": 0,
        "silence_breaks": 188,
        "forced_breaks": 188,
        "punctuation_breaks": 259,
        "no_legal_alternative": 66,
        "final_tail_eligible": 6,
        "terminal_final_tails": 1,
        "exempted_cues": 0
      },
      "len_break_mid_phrase_rate": {
        "bad": 1,
        "eligible": 464,
        "value": 0.0021551724137931034
      },
      "over_7s_rate": {
        "bad": 0,
        "eligible": 659,
        "value": 0.0
      },
      "forbidden_end_rate": {
        "bad": 0,
        "eligible": 145,
        "value": 0.0
      }
    },
    "zh": {
      "case_count": 7,
      "cue_count": 857,
      "cps_p90": {
        "n": 857,
        "value": 9.615384615384624,
        "median": 6.976744186046516,
        "p95": 10.714285714285724,
        "target_cps": 9.0,
        "absolute_max": 11.25
      },
      "phrase_granularity": [
        "phrase"
      ],
      "diagnostics": {
        "unit_count": 11740,
        "cue_count": 857,
        "lyric_cue_count": 0,
        "internal_boundaries": 850,
        "unmapped_boundaries": 0,
        "overlapping_cues": 0,
        "silence_breaks": 11,
        "forced_breaks": 8,
        "punctuation_breaks": 629,
        "no_legal_alternative": 3,
        "final_tail_eligible": 6,
        "terminal_final_tails": 1,
        "exempted_cues": 0
      },
      "len_break_mid_phrase_rate": {
        "bad": 0,
        "eligible": 839,
        "value": 0.0
      },
      "over_7s_rate": {
        "bad": 0,
        "eligible": 857,
        "value": 0.0
      },
      "forbidden_end_rate": {
        "bad": 0,
        "eligible": 216,
        "value": 0.0
      }
    }
  },
  "gates": {
    "len_break_mid_phrase_rate": {
      "direction": "lower_is_better",
      "mode": "blocking",
      "absolute_max": 0.1,
      "absolute_tolerance": 0.01,
      "relative_tolerance": 0.1,
      "min_samples": 100
    },
    "over_7s_rate": {
      "direction": "lower_is_better",
      "mode": "blocking",
      "absolute_max": 0.0,
      "absolute_tolerance": 0.0,
      "relative_tolerance": 0.0,
      "min_samples": 1
    },
    "cps_p90": {
      "direction": "lower_is_better",
      "mode": "blocking",
      "absolute_max": null,
      "absolute_tolerance": 0.5,
      "relative_tolerance": 0.05,
      "min_samples": 100
    },
    "forbidden_end_rate": {
      "direction": "lower_is_better",
      "mode": "warning",
      "absolute_max": null,
      "absolute_tolerance": 1.0,
      "relative_tolerance": 0.0,
      "min_samples": 100
    }
  }
}
